"","variable","label","type","range","missing","distribution"
"ParticipantNumber","ParticipantNumber","Unique participant ID","tiny_labelled, factor","386",0,""
"Location","Location","Data collection site (Florida, Williams, Hong Kong, Illinois, Yale)","tiny_labelled, factor","5",0,""
"Block","Block","Block of learning procedure (1 vs. 2)","tiny_labelled, factor","2",0,""
"ValenceBlock","ValenceBlock","Order of valence of behavior description (Positive-negative vs. Negative-positive)","tiny_labelled, factor","2",0,""
"IATscore","IATscore","Mean difference of cleaned log-transformed RTs between congruent (Bob & negative words) and incongruent (Bob & positive words) blocks","tiny_labelled, numeric","[-0.533520137187296, 0.747721378545897]",0,"▁▁▂▇▇▂▁▁"
"Eval","Eval","Average of the z-standardized evaluative Likert-scale responses","tiny_labelled, numeric","[-1.09613159385547, 1.25790348258266]",0,"▇▂▁▁▁▁▂▇"
"frameRate","frameRate","Frame rate [Hz]","tiny_labelled, numeric","[72, 100]",0,"▇▁▁▁▁▁▁▇"
"Duration","Duration","Presentation duration of briefly flashed words (13 ms vs. 20 ms)","tiny_labelled, factor","2",0,""
"Country","Country","Country of data collection (USA vs. Hong Kong)","tiny_labelled, factor","2",0,""
